Entry,Definition,ref
niminy-piminy,"Mincing, affected; without force, drive, or spirit.",Rhyme Over Reason : Phonological Motivation in English
nipper,"To whisper, to gossip.",Rhyme Over Reason : Phonological Motivation in English
nuh-uh,No; used esp. to rebuff or contradict.,Rhyme Over Reason : Phonological Motivation in English
num,"An exclamation of pleasurable anticipation, with implication of sensual or gustatory satisfaction.",Rhyme Over Reason : Phonological Motivation in English
nummy,"Of food: delicious, yummy, especially tasty or tempting.",Rhyme Over Reason : Phonological Motivation in English
nyaff,"Of a (small) dog: to yelp, bark. Hence, of a child or small or insignificant person: to speak in a cheeky or peevish manner; to whinge.",Rhyme Over Reason : Phonological Motivation in English
nyah,Expressing the speaker’s feeling of superiority or contempt for another.,Rhyme Over Reason : Phonological Motivation in English
oink,Representing a grunting sound made by a pig or (occasionally) a similar sound made by another creature. Also representing a human imitation of such a sound.,Rhyme Over Reason : Phonological Motivation in English
oompah,The repetitive rhythmical sound characteristic of a deep-toned brass instrument in a band; a sound or musical accompaniment resembling this.,Rhyme Over Reason : Phonological Motivation in English
oomph,"The quality of being exciting, energetic, or sexually attractive; energy, vigour.",Rhyme Over Reason : Phonological Motivation in English
ooyah,Expressing sudden pain.,Rhyme Over Reason : Phonological Motivation in English
ou,"Expressing surprise, excitement, or a similar emotion.",Rhyme Over Reason : Phonological Motivation in English
ouch,Expressing sudden physical pain.,Oxford English Dictionary
ouff,Of a dog: to bark.,Rhyme Over Reason : Phonological Motivation in English
ough,In early use: used in imitation of a sound denoting various sentiments.,Rhyme Over Reason : Phonological Motivation in English
paff,"Used to represent the sound of an impact, blow, explosion.",Rhyme Over Reason : Phonological Motivation in English
pah,Expressing disgust or disdain.,Rhyme Over Reason : Phonological Motivation in English
pamp,To pamper with food; to fatten.,Rhyme Over Reason : Phonological Motivation in English
pang,"Representing a short resonant sound, such as that produced by the striking of metal, etc.",Rhyme Over Reason : Phonological Motivation in English
pash,"To hurl or throw (something) violently, so as break it against something or smash something with it.",Rhyme Over Reason : Phonological Motivation in English
pat,Representing a patting sound; with a pat.,Rhyme Over Reason : Phonological Motivation in English
pech,"To breathe hard, as from exertion, or with difficulty; to puff, to pant; to become short of breath.",Rhyme Over Reason : Phonological Motivation in English
peeoy,A kind of home-made firework consisting of a small cone of damp gunpowder which is lighted at the top.,Rhyme Over Reason : Phonological Motivation in English
peesweep,,
peeweep,,
peewit,,
peetweet,,
petchary,,
petter,"To make a light, rapid, repetitious sound.",Rhyme Over Reason : Phonological Motivation in English
pew,"The thin cry of a bird, esp. of the kite.",Rhyme Over Reason : Phonological Motivation in English
pew,"Of a bird, esp. a kite: to cry in a plaintive manner.",Rhyme Over Reason : Phonological Motivation in English
pew,"Expressing contempt, disgust, or derision.",Rhyme Over Reason : Phonological Motivation in English
pewewe,Representing the plaintive call of some birds of prey.,Rhyme Over Reason : Phonological Motivation in English
phah,An ejaculation expressing contempt or disgust.,Rhyme Over Reason : Phonological Motivation in English
pheal,The cry of the jackal when hunting.,Rhyme Over Reason : Phonological Motivation in English
phew,The cry of the jackal when hunting.,Rhyme Over Reason : Phonological Motivation in English
phit,"Representing various sounds, esp. of a short explosive nature, as the brief rapid expulsion of air, the sound made by a rifle bullet, etc.",Rhyme Over Reason : Phonological Motivation in English
pho,Expressing contemptuous rejection or dismissal.,Rhyme Over Reason : Phonological Motivation in English
phoo,"Expressing contemptuous rejection, cursory dismissal (of a proposition, idea, etc.), disagreement, or reproach.",Rhyme Over Reason : Phonological Motivation in English
phu,"A brief plosive sound, such as the noise made by the escape of a small quantity of air under pressure, or by the passage of a bullet, or the sound of a small muffled explosion.",Rhyme Over Reason : Phonological Motivation in English
phwoar,"As an enthusiastic expression of desire, approval, or excitement, esp. in regard to sexual attractiveness.",Rhyme Over Reason : Phonological Motivation in English
piff,"To blow, play (on a flute).",Rhyme Over Reason : Phonological Motivation in English
piff,"Representing the sound of a short, abrupt displacement or passage of air as caused by the flight of a bullet, a small explosion, etc.",Rhyme Over Reason : Phonological Motivation in English
piffle,"To talk or behave in an ineffectual way; to talk nonsense, to witter; to dither or fiddle.",Rhyme Over Reason : Phonological Motivation in English
pimlico,,
pinchem,,
pinc-pinc,,
ping,"Representing a short, resonant, high-pitched (usually metallic) sound, as that made by the firing of a bullet, the ringing of a small bell, etc.",Rhyme Over Reason : Phonological Motivation in English
pinge,"Representing a short, resonant, high-pitched (usually metallic) sound, as that made by the firing of a bullet, the ringing of a small bell, etc.",Rhyme Over Reason : Phonological Motivation in English
ping-pong,The game of table tennis.,Rhyme Over Reason : Phonological Motivation in English
ping-pong,Also more fully ping-pong drum. A drum which supplies the melody in a Caribbean steel band; a tenor pan.,Rhyme Over Reason : Phonological Motivation in English
pink,Something which makes a short sharp noise.,Rhyme Over Reason : Phonological Motivation in English
pink,"To trickle, to drip; to make a tinkling sound while dripping.",Rhyme Over Reason : Phonological Motivation in English
pip,"A short, high-pitched electronic tone used as a signal.",Rhyme Over Reason : Phonological Motivation in English
pip,To toot or beep (a person) with the horn of a vehicle; to sound (a horn).,Rhyme Over Reason : Phonological Motivation in English
pipit,,
pip-pip,"Imitating a repeated, short, high-pitched sound, esp. one made by a car or bicycle horn.",Rhyme Over Reason : Phonological Motivation in English
pip-pop,Imitating the sound of gun fire.,Rhyme Over Reason : Phonological Motivation in English
piramidig,,
pirn,,
pirrie,"A sudden, strong blast of wind; a squall; a storm.",Rhyme Over Reason : Phonological Motivation in English
pish,"Expressing contempt, impatience, or disgust.",Rhyme Over Reason : Phonological Motivation in English
pist,"Used to attract attention, or to convey important or secret information.",Rhyme Over Reason : Phonological Motivation in English
pit,"Representing a sharp light sound, as of water against a windowpane.",Rhyme Over Reason : Phonological Motivation in English
pit-a-pat,"With a series of rapidly alternating or repeated light sounds, as of a quick heartbeat, footsteps, etc.",Rhyme Over Reason : Phonological Motivation in English
plap,To come down or fall with the sound of a flat impact; to make a light slapping sound.,Rhyme Over Reason : Phonological Motivation in English
plapper,"To make a gentle repetitive slapping or plopping sound, as by moving the lips, splashing water, etc.",Rhyme Over Reason : Phonological Motivation in English
plash,"The sound made when a body strikes the surface of water so as to break it up, or plunges into or through it.",Rhyme Over Reason : Phonological Motivation in English
plash,"To break the surface of, plunge into, or otherwise stir up (water or other liquid) with commotion and splashing.",Rhyme Over Reason : Phonological Motivation in English
platch,"To splash or mark with drops of water, etc.",Oxford English Dictionary
pleep,"A shrill piping cry, esp. that of a wading bird; the weak peeping cry of a young bird.",Rhyme Over Reason : Phonological Motivation in English
plink,"To cause (something) to emit a short, sharp, metallic tinkling or ringing sound.",Rhyme Over Reason : Phonological Motivation in English
plip,"Representing a small, abrupt, hollow sound, as of an object dropping into water, a bubble bursting softly, etc. ",Rhyme Over Reason : Phonological Motivation in English
plish,A splashing sound.,Rhyme Over Reason : Phonological Motivation in English
plonk,To hit or strike (someone or something) with a heavy thud.,Rhyme Over Reason : Phonological Motivation in English
plop,"To fall or move with or as with a plop, esp. when, or as if, landing in water.",Rhyme Over Reason : Phonological Motivation in English
plout,The action of plunging or submerging.,Rhyme Over Reason : Phonological Motivation in English
plout,To fall with a splash; to plunge or splash in water.,Oxford English Dictionary
pluff,"A strong puff or explosive emission of air, powder, smoke, etc., esp. from the firing of a gun.",Oxford English Dictionary
pluff,"To blow out with a puff, esp. suddenly or explosively, to blow or propel (something) from the mouth or through a tube.",Oxford English Dictionary
plump,To land with a splash; to plunge into water.,Rhyme Over Reason : Phonological Motivation in English
plump,"With an abrupt or heavy fall or drop; with a thud or a sudden impact; suddenly, unexpectedly.",Rhyme Over Reason : Phonological Motivation in English
plung,Representing the resonant sound made by a tennis racket striking a ball.,Rhyme Over Reason : Phonological Motivation in English
plunk,To place or set down heavily or suddenly.,Oxford English Dictionary
plup,A soft splashing or popping sound.,Rhyme Over Reason : Phonological Motivation in English
pob,"Representing an abrupt, heavy sound, as of an inelastic body striking a hard surface.",Rhyme Over Reason : Phonological Motivation in English
pobblebonk,"Either of two Australian frogs of the genus Limnodynastes (family Myobatrachidae) having a loud, twang-like, single-note call.",Rhyme Over Reason : Phonological Motivation in English
pock,"An abrupt percussive sound, as of a bat striking a ball, a bullet striking a wall, etc.",Rhyme Over Reason : Phonological Motivation in English
pocketa-pocketa,"Representing a series of rapidly repeated percussive sounds, such as those made by an internal combustion engine.",Rhyme Over Reason : Phonological Motivation in English
podge,To walk slowly and heavily.,Rhyme Over Reason : Phonological Motivation in English
poh,Expressing contemptuous rejection.,Rhyme Over Reason : Phonological Motivation in English
pong,"A blow, a bang; a short, resonant, low-pitched sound.",Rhyme Over Reason : Phonological Motivation in English
poof,"Expressing contempt, disgust, or distaste as conveyed by the emission of a short sharp puff of breath.",Rhyme Over Reason : Phonological Motivation in English
pooh,"Expressing impatience, contempt, disdain, etc.",Oxford English Dictionary
poop,"To produce a short blast of sound, as with a horn; to blow, toot; to make a gulping sound in drinking.",Rhyme Over Reason : Phonological Motivation in English
poorwill,,
poot,"An act of breaking wind, a fart.",Rhyme Over Reason : Phonological Motivation in English
pop,"A blow, a knock, a punch; a slight rap or tap.",Rhyme Over Reason : Phonological Motivation in English
pope,,
popple,"To flow in a tumbling manner, as water from a spring or over a pebbly surface; to tumble about, as boiling or otherwise agitated liquid; to bubble up; to ripple.",Rhyme Over Reason : Phonological Motivation in English
potoo,,
potrack,Representing the call of a guineafowl.,Rhyme Over Reason : Phonological Motivation in English
pow,"Representing the sound of a blow, punch, shot, etc.",Rhyme Over Reason : Phonological Motivation in English
pring,The sound made by a bell.,Rhyme Over Reason : Phonological Motivation in English
pring,To make a sound like a bell.,Rhyme Over Reason : Phonological Motivation in English
proo,"Used as a call to a cow or calf, or to command a horse to stop, stand still, etc.",Rhyme Over Reason : Phonological Motivation in English
prut,"An exclamation of contempt, disbelief, etc.",Rhyme Over Reason : Phonological Motivation in English
pshaw,"Expressing contempt, impatience, or disgust, or used to depreciate or dismiss some statement or notion.",Rhyme Over Reason : Phonological Motivation in English
psht,"Expressing caution, surprise, or impatience.",Rhyme Over Reason : Phonological Motivation in English
psst,"Used to attract attention or give warning, esp. surreptitiously.",Rhyme Over Reason : Phonological Motivation in English
pst,Expressing a whispered signal for silence.,Rhyme Over Reason : Phonological Motivation in English
ptish,An exclamation of contempt or disdain.,Rhyme Over Reason : Phonological Motivation in English
ptui,Representing the sound of a person spitting; (hence) expressing disgust or contempt.,Rhyme Over Reason : Phonological Motivation in English
pudge,To walk or move slowly and heavily; to trudge.,Rhyme Over Reason : Phonological Motivation in English
puff,"To blow out (air, one’s breath, smoke, etc.), esp. in a short abrupt blast or blasts.",Rhyme Over Reason : Phonological Motivation in English
puff-puff,The sound of repeated puffing by a steam engine; (esp. in children’s language) a steam locomotive or steam train.,Rhyme Over Reason : Phonological Motivation in English
punk,"To force, thrust, or propel in a specified direction.",Rhyme Over Reason : Phonological Motivation in English
pup,To make a dismissive or contemptuous sound with the lips.,Rhyme Over Reason : Phonological Motivation in English
purl,"To turn upside down, overturn, or capsize; to pitch or tumble head over heels.",Oxford English Dictionary
purl,"Of a cat: to purr. Also in later use, esp. of an engine: to make a sound resembling a cat’s purr.",Rhyme Over Reason : Phonological Motivation in English
purr,"An act of purring; the low vibrating sound made by a cat, usually when pleased or contented.",Rhyme Over Reason : Phonological Motivation in English
purr,"Of a cat or another feline animal: to make a low, continuous, vibratory sound taken to be expressive of satisfaction or pleasure.",Rhyme Over Reason : Phonological Motivation in English
purr,Used as a call to pigs or turkeys. Formerly also in extended use.,Rhyme Over Reason : Phonological Motivation in English
purre,"The dunlin (Calidris alpina) in its winter plumage, formerly thought to be a separate species.",Rhyme Over Reason : Phonological Motivation in English
push,"Expressing contempt, impatience, or disgust.",Oxford English Dictionary
put-put,"Of a device, engine, vehicle, etc.: that makes a rapid intermittent sound, esp. one characteristic of a small internal combustion engine.",Rhyme Over Reason : Phonological Motivation in English
put-put,To make a rapid intermittent sound characteristic of a small internal combustion engine.,Rhyme Over Reason : Phonological Motivation in English
putter,"To make a rapid, intermittent sound, esp. that of small internal combustion engine.",Rhyme Over Reason : Phonological Motivation in English
py hy,Representing the sound of laughter.,Rhyme Over Reason : Phonological Motivation in English
quack,A state of hoarseness or croakiness in the throat.,Rhyme Over Reason : Phonological Motivation in English
quack,Of a duck: to make its characteristic harsh sound.,Rhyme Over Reason : Phonological Motivation in English
quack,"Representing the characteristic harsh sound of a duck, or a noise resembling this.",Rhyme Over Reason : Phonological Motivation in English
quake,"Representing the characteristic harsh sound of a duck, or a noise resembling this.",Rhyme Over Reason : Phonological Motivation in English
quafer,To find (a thing) by feeling about.,Rhyme Over Reason : Phonological Motivation in English
qualm,The sound of the cry of a raven.,Rhyme Over Reason : Phonological Motivation in English
quank,Representing a harsh croaking or honking sound made by certain birds and animals.,Rhyme Over Reason : Phonological Motivation in English
quawk,"The black-crowned night heron, which has a deep, hoarse call.",Rhyme Over Reason : Phonological Motivation in English
quawk,"Of a bird or other creature, esp. a rook, crow, or domestic fowl: to utter a harsh call, to squawk.",Rhyme Over Reason : Phonological Motivation in English
queck,Representing a choking sound or a death rattle.,Rhyme Over Reason : Phonological Motivation in English
queef,"An audible release of air from the vagina, typically during or after sexual intercourse.",Rhyme Over Reason : Phonological Motivation in English
quelch,To make squelchy sounds.,Rhyme Over Reason : Phonological Motivation in English
quirk,"To grunt, croak, groan, sigh, etc.; to grumble, complain.",Rhyme Over Reason : Phonological Motivation in English
quiz,To make a whirring sound.,Rhyme Over Reason : Phonological Motivation in English
quop,"To tremble, wriggle, writhe; to throb, pulsate, palpitate.",Rhyme Over Reason : Phonological Motivation in English
raish,A harsh swish.,Rhyme Over Reason : Phonological Motivation in English
ralph,To vomit.,Rhyme Over Reason : Phonological Motivation in English
ramp,To eat greedily or noisily.,Rhyme Over Reason : Phonological Motivation in English
randan,"Riotous or disorderly behaviour; a rowdy celebration or excursion, a spree.",Rhyme Over Reason : Phonological Motivation in English
ran-tan,"To vituperate, rail against, or upbraid a person.",Rhyme Over Reason : Phonological Motivation in English
ran-tan,"Representing a loud and repetitive banging noise, esp. that made by knocking or drumming.",Rhyme Over Reason : Phonological Motivation in English
rap,"Senses relating to a blow, stroke, or loud noise.",Rhyme Over Reason : Phonological Motivation in English
rash,A rustling or scraping noise.,Rhyme Over Reason : Phonological Motivation in English
rasteling,"A disturbance, a commotion.",Rhyme Over Reason : Phonological Motivation in English
ratamacue,"One of the basic patterns or rudiments of drumming, consisting of a triplet preceded by a two-stroke drag and followed by an accented beat.",Rhyme Over Reason : Phonological Motivation in English
rat-a-tat,"Representing or imitating a series of short, sharp, rapping or tapping sounds, as produced by firing a gun, knocking at a door, etc.",Rhyme Over Reason : Phonological Motivation in English
tattartattar,"Representing or imitating a series of short, sharp, rapping or tapping sounds, as produced by firing a gun, knocking at a door, etc.",Rhyme Over Reason : Phonological Motivation in English
rattan,A drumming or beating noise; a tattoo.,Rhyme Over Reason : Phonological Motivation in English
rat-tat,"A sharp rapping sound, esp. of a knock at a door or of reports from a gun, etc.",Rhyme Over Reason : Phonological Motivation in English
tat-tat,"A sharp rapping sound, esp. of a knock at a door or of reports from a gun, etc.",Rhyme Over Reason : Phonological Motivation in English
ribbit,"Representing the characteristic sound made by a frog, or an imitation of this.",Rhyme Over Reason : Phonological Motivation in English
rickle,"To make a rattling, clattering, or jingling sound.",Rhyme Over Reason : Phonological Motivation in English
ricky-tick,,
riff,"To flick through (papers, books, etc.); to thumb (a block of paper, a book, etc.), releasing the leaves in (usually rapid) succession.",Rhyme Over Reason : Phonological Motivation in English
riff-raff,"A tumult, a racket; the sound of this.",Rhyme Over Reason : Phonological Motivation in English
rifty-tufty,In disorderly haste or confusion; helter-skelter.,Rhyme Over Reason : Phonological Motivation in English
rim ram ruff,,
roocoocoo,To make the soft murmuring sound or note characteristic of doves and pigeons.,Rhyme Over Reason : Phonological Motivation in English
rooty-toot,"To make a tooting sound with, or as with, a horn or trumpet.",Rhyme Over Reason : Phonological Motivation in English
rounce,"To behave in an agitated, boisterous, or noisy manner.",Rhyme Over Reason : Phonological Motivation in English
rous,With a bounce or a bang.,Rhyme Over Reason : Phonological Motivation in English
row,"A noisy or violent argument, a quarrel with someone.",Rhyme Over Reason : Phonological Motivation in English
row dow dow,"A series of resonant sounds, as produced by beating a drum.",Rhyme Over Reason : Phonological Motivation in English
rub-a-dub,The sound of a drum being beaten; a drumming sound.,Rhyme Over Reason : Phonological Motivation in English
rub-a-dub-dub,The sound of a drum being beaten; a drumming sound.,Rhyme Over Reason : Phonological Motivation in English
ruff,"One of the ornamental rudiments of side drum playing, consisting of three quick strokes followed by a fourth, producing a light militaristic roll.",Rhyme Over Reason : Phonological Motivation in English
ruff,"Representing the characteristic bark of a dog, or a human imitation of such a bark.",Rhyme Over Reason : Phonological Motivation in English
ruffle,A rapid vibrating drum beat.,Rhyme Over Reason : Phonological Motivation in English
ruff-raff,Noisy.,Rhyme Over Reason : Phonological Motivation in English
rufty-tufty,"Rumbustious, boisterous; rough, tough.",Rhyme Over Reason : Phonological Motivation in English
rum-ti-too,Commonplace.,Rhyme Over Reason : Phonological Motivation in English
rum-ti-tum,Used as a meaningless refrain or to represent a regular rhythmic sound.,Rhyme Over Reason : Phonological Motivation in English
rum-tum,Used to represent a regular rhythmic musical sound.,Rhyme Over Reason : Phonological Motivation in English
rustle,To make a sound typically caused by the shaking or friction of surfaces (usually a soft muffled sound).,Rhyme Over Reason : Phonological Motivation in English
scape,A conventional imitation of the cry of the snipe when flushed (also used for the brambling’s call).,Rhyme Over Reason : Phonological Motivation in English
scat,A blow or buffet.,Rhyme Over Reason : Phonological Motivation in English
scat,,
scat,To fall down; to break in pieces; to become bankrupt.,Rhyme Over Reason : Phonological Motivation in English
scraich,To utter a harsh cry.,Rhyme Over Reason : Phonological Motivation in English
scraigh,To utter a harsh cry.,Rhyme Over Reason : Phonological Motivation in English
scranch,To crush with the teeth (a thing somewhat firm and brittle); to chew or bite with a crushing noise.,Rhyme Over Reason : Phonological Motivation in English
scraugh,To utter a loud hoarse cry.,Rhyme Over Reason : Phonological Motivation in English
scraw,To clear the throat.,Rhyme Over Reason : Phonological Motivation in English
screed,"To make a loud, harsh, screeching noise as of something ripping or scraping.",Rhyme Over Reason : Phonological Motivation in English
scride,To make a shrill sound.,Rhyme Over Reason : Phonological Motivation in English
scritch,To utter a loud shrill cry or screech.,Rhyme Over Reason : Phonological Motivation in English
scroop,"A harsh, strident, or scraping noise.",Rhyme Over Reason : Phonological Motivation in English
scroop,"To make a strident, grating, or scraping sound; to grate, creak, squeak.",Rhyme Over Reason : Phonological Motivation in English
seesee,,
shale,Of water: To make the sound characteristic of tidal movement near the shore.,Rhyme Over Reason : Phonological Motivation in English
shallal,A serenade of kettles and pans given to a notorious wedding couple.,Rhyme Over Reason : Phonological Motivation in English
shinder,To shiver or shatter in pieces.,Rhyme Over Reason : Phonological Motivation in English
shoy-hoy,One who scares away birds from a sown field.,Rhyme Over Reason : Phonological Motivation in English
shoyhoy,One who scares away birds from a sown field.,Rhyme Over Reason : Phonological Motivation in English
simper,"To smile in a silly, self-conscious, or affectedly coy or bashful manner, or in a way that is expressive of or is intended to convey guileless pleasure, childlike innocence, or the like.",Oxford English Dictionary
sing-sing,A singing or ringing sound.,Rhyme Over Reason : Phonological Motivation in English
sis-boom-bah,A shout expressive of support or encouragement to a college team.,Rhyme Over Reason : Phonological Motivation in English
sistle,To emit a kind of hissing sound.,Rhyme Over Reason : Phonological Motivation in English
sizz,"To burn, brand.",Rhyme Over Reason : Phonological Motivation in English
sizzle,To burn or scorch so as to produce a hissing sound; to burn up with intense heat.,Rhyme Over Reason : Phonological Motivation in English
ska,"A style of popular music of Jamaican origin, characterized by a fast tempo and strongly accentuated offbeat.",Oxford English Dictionary
skelloch,"To shriek, yell; to resound shrilly.",Rhyme Over Reason : Phonological Motivation in English
skelp,"To strike, beat, slap, smack, in later use spec. on the breech.",Rhyme Over Reason : Phonological Motivation in English
skronk,"Representing any of various loud, harsh sounds.",Rhyme Over Reason : Phonological Motivation in English
slatter,To clatter.,Rhyme Over Reason : Phonological Motivation in English
slodge,To trail or drag the feet in walking; to walk slouchingly.,Rhyme Over Reason : Phonological Motivation in English
sloff,"To eat greedily, dirtily, or slovenly.",Rhyme Over Reason : Phonological Motivation in English
slosh,"To hit, to strike; to crush, to defeat.",Oxford English Dictionary
