Entry,Definition,ref
flipper-de-flapper,Noise and confusion caused by show.,Rhyme Over Reason : Phonological Motivation in English
flirt,"To propel or throw with a jerk or sudden movement; often, to propel by a blow from the finger-nail released from the thumb.",Rhyme Over Reason : Phonological Motivation in English
flish,To slash or cut.,Rhyme Over Reason : Phonological Motivation in English
flisk,To move or dance about in a frolicsome way; to frisk.,Rhyme Over Reason : Phonological Motivation in English
flitch,A stroke.,Rhyme Over Reason : Phonological Motivation in English
flizz,To fly off.,Rhyme Over Reason : Phonological Motivation in English
flobber,"To dirty, soil.",Rhyme Over Reason : Phonological Motivation in English
flod,To walk slowly.,Rhyme Over Reason : Phonological Motivation in English
flog,"To beat, whip; to chastise with repeated blows of a rod or whip.",Rhyme Over Reason : Phonological Motivation in English
flouse,To splash.,Rhyme Over Reason : Phonological Motivation in English
floush,To splash.,Rhyme Over Reason : Phonological Motivation in English
flummer,"To repeat indistinctly, mumble.",Rhyme Over Reason : Phonological Motivation in English
flump,To fall or move heavily with a dull noise.,Rhyme Over Reason : Phonological Motivation in English
flunge,To fly or be flung out with sudden impetus.,Rhyme Over Reason : Phonological Motivation in English
flurr,"To scatter, throw about.",Rhyme Over Reason : Phonological Motivation in English
flurry,"A sudden agitation of the air, a gust or squall.",Rhyme Over Reason : Phonological Motivation in English
flush,To fly up quickly and suddenly; to start up and fly away.,Rhyme Over Reason : Phonological Motivation in English
fnarr-fnarr,Representing lecherous or half-suppressed laughter. Frequently used to indicate sexual innuendo.,Rhyme Over Reason : Phonological Motivation in English
frab,"To harass, worry.",Rhyme Over Reason : Phonological Motivation in English
frap,A noise made by knocking.,Rhyme Over Reason : Phonological Motivation in English
fratch,To make a harsh or strident noise; to creak.,Rhyme Over Reason : Phonological Motivation in English
fribble,"To falter, stammer (out).",Rhyme Over Reason : Phonological Motivation in English
fridge,To move restlessly (about or up and down); to fidget.,Rhyme Over Reason : Phonological Motivation in English
frill,Of the eagle: to scream.,Rhyme Over Reason : Phonological Motivation in English
fruz,"A collection of short and small branches, producing a frizzy appearance.",Rhyme Over Reason : Phonological Motivation in English
fub(b),A small chubby person. Chiefly used as a term of endearment.,Rhyme Over Reason : Phonological Motivation in English
fub(b)s,A small chubby person. Chiefly used as a term of endearment.,Rhyme Over Reason : Phonological Motivation in English
fubble,To jumble (up).,Rhyme Over Reason : Phonological Motivation in English
fuff,"To puff. Said of a breeze, fire, etc.; also, of a person in anger or out of breath.",Rhyme Over Reason : Phonological Motivation in English
fuffle,"To throw into disorder; to jerk about; to hustle, treat with contumely.",Rhyme Over Reason : Phonological Motivation in English
fum,To play (on a guitar) with the fingers.,Rhyme Over Reason : Phonological Motivation in English
funk,To kick.,Rhyme Over Reason : Phonological Motivation in English
fuss,A bustle or commotion out of proportion to the occasion; a needless or excessive display of concern about anything; ostentatious or officious activity.,Rhyme Over Reason : Phonological Motivation in English
fustle,To make a bustle or commotion out of proportion to the occasion.,Rhyme Over Reason : Phonological Motivation in English
fute,To whistle.,Rhyme Over Reason : Phonological Motivation in English
fuzz,"Loose volatile matter; a mass of fine, light, fluffy particles.",Rhyme Over Reason : Phonological Motivation in English
fuzz,To make the humming sibilant sound characteristic of bees and other insects.,Rhyme Over Reason : Phonological Motivation in English
gab,"To talk much or glibly; to chatter, prate.",Rhyme Over Reason : Phonological Motivation in English
gabber,"To talk volubly, to jabber.",Rhyme Over Reason : Phonological Motivation in English
gabble,"To talk volubly, inarticulately and incoherently; to chatter, jabber, prattle.",Rhyme Over Reason : Phonological Motivation in English
gag,"A ‘made-up’ story; a piece of deception, an imposture, a lie.",Rhyme Over Reason : Phonological Motivation in English
gag,"To strangle, suffocate.",Rhyme Over Reason : Phonological Motivation in English
gag,"To jerk; to strike with a sharp blow. Also, to toss up (the head).",Rhyme Over Reason : Phonological Motivation in English
gaggle,Of geese: to cackle.,Rhyme Over Reason : Phonological Motivation in English
gah,An exclamation indicating impatience or exasperation.,Rhyme Over Reason : Phonological Motivation in English
gallop,"The most rapid movement of a horse (occasionally of other quadrupeds), in which in the course of each stride the animal is entirely off the ground, with the legs flexed under the body.",Oxford English Dictionary
gamp,To devour or eat greedily; to gulp down.,Rhyme Over Reason : Phonological Motivation in English
garre,"To growl, snarl; to chatter, chide; to chirp, twitter.",Rhyme Over Reason : Phonological Motivation in English
gawf,A loud noisy laugh.,Rhyme Over Reason : Phonological Motivation in English
gawl,To bawl out.,Rhyme Over Reason : Phonological Motivation in English
geremumble,To garbage (fish).,Rhyme Over Reason : Phonological Motivation in English
gibber,"To speak rapidly and inarticulately; to chatter, talk nonsense. Said also of an ape.",Rhyme Over Reason : Phonological Motivation in English
gig,A squeaking noise.,Oxford English Dictionary
gig,To move backwards and forwards.,Oxford English Dictionary
giggle,"To laugh continuously in a manner not uproarious, but suggestive either of foolish levity or uncontrollable amusement.",Rhyme Over Reason : Phonological Motivation in English
ging,,
ging,"To jingle, to tinkle.",Rhyme Over Reason : Phonological Motivation in English
glash,To come like a flash of light.,Rhyme Over Reason : Phonological Motivation in English
globbe,"To swallow (drink or food) quickly or in large mouthfuls, to gulp; to drink or eat gluttonously.",Rhyme Over Reason : Phonological Motivation in English
gloffer,A gluttonous eater.,Rhyme Over Reason : Phonological Motivation in English
glop,To swallow greedily.,Rhyme Over Reason : Phonological Motivation in English
glotter,"To utter a series of short, quick, usually high-pitched sounds. ",Rhyme Over Reason : Phonological Motivation in English
glub,An inarticulate sound rendered by this spelling.,Rhyme Over Reason : Phonological Motivation in English
gluck,An inarticulate sound supposed to be expressed by this spelling.,Rhyme Over Reason : Phonological Motivation in English
gluck,,
glug,A word formed to imitate an inarticulate sound.,Rhyme Over Reason : Phonological Motivation in English
glug,,
glut-glut,To swallow or gulp down.,Rhyme Over Reason : Phonological Motivation in English
glutter,A noise or fuss.,Rhyme Over Reason : Phonological Motivation in English
gnacche,"To strike (the teeth) together, as in rage or anguish.",Rhyme Over Reason : Phonological Motivation in English
gnap,To bite in a snapping fashion.,Rhyme Over Reason : Phonological Motivation in English
gnar,"To snarl, growl.",Rhyme Over Reason : Phonological Motivation in English
gnip,"To nip, bite. Of a horse: To champ (the bit).",Rhyme Over Reason : Phonological Motivation in English
go-away,,
gobble,Of a male turkey: to make its characteristic gurgling sound in the throat.,Rhyme Over Reason : Phonological Motivation in English
goggle,Of a male turkey: to make its characteristic gurgling sound in the throat.,Rhyme Over Reason : Phonological Motivation in English
gobble,Representing the characteristic gurgling sound made by a male turkey in its throat.,Rhyme Over Reason : Phonological Motivation in English
godwit,,
goggle,"Of persons: To turn the eyes to one side or other, to look obliquely, to squint.",Rhyme Over Reason : Phonological Motivation in English
golf,"Of a pig: To grunt or snort, as in rage.",Rhyme Over Reason : Phonological Motivation in English
gollar,To utter loud but thick and scarcely articulate sounds; to shout.,Oxford English Dictionary
goller,To utter loud but thick and scarcely articulate sounds; to shout.,Oxford English Dictionary
golly,To shout with a thick voice.,Rhyme Over Reason : Phonological Motivation in English
goo,To make an inarticulate cooing or gurgling noise such as that made by babies and small children.,Rhyme Over Reason : Phonological Motivation in English
goo-goo,An imitative representation of baby talk.,Rhyme Over Reason : Phonological Motivation in English
gothele,"To make a low rumbling noise, as bubbles rising through water, or as is heard in the bowels.",Rhyme Over Reason : Phonological Motivation in English
granch,Of the teeth: To gnash.,Rhyme Over Reason : Phonological Motivation in English
grash,"To strike together or ‘grind’ the teeth, esp. from rage or anguish.",Rhyme Over Reason : Phonological Motivation in English
grassil,"To make a harsh noise; to creak, rattle, to make a harsh noise with (the teeth or tusks), to gnash.",Rhyme Over Reason : Phonological Motivation in English
graunch,To make a crunching or grinding sound.,Rhyme Over Reason : Phonological Motivation in English
grent,To gnash the teeth.,Rhyme Over Reason : Phonological Motivation in English
grinch,To make a harsh grating noise.,Rhyme Over Reason : Phonological Motivation in English
grint,To grind or gnash the teeth.,Rhyme Over Reason : Phonological Motivation in English
grolling,Rumbling.,Rhyme Over Reason : Phonological Motivation in English
grouze,To devour or munch with a crunching sound.,Rhyme Over Reason : Phonological Motivation in English
growl,Of the bowels: to rumble.,Rhyme Over Reason : Phonological Motivation in English
grump,"Humps, slights and snubs.",Rhyme Over Reason : Phonological Motivation in English
grumph,To grunt; said both of animals and human beings.,Rhyme Over Reason : Phonological Motivation in English
grundy,,
gubble,To make the sound rendered by ‘gub’: a verb formed to imitate an inarticulate sound.,Rhyme Over Reason : Phonological Motivation in English
guddle,To gargle.,Rhyme Over Reason : Phonological Motivation in English
guff,"A puff, whiff.",Rhyme Over Reason : Phonological Motivation in English
guffaw,A burst of coarse laughter; a loud or boisterous laugh.,Rhyme Over Reason : Phonological Motivation in English
gugg,"To wound, gall.",Rhyme Over Reason : Phonological Motivation in English
guggle,To make a sound like that made by liquid pouring from a small-necked bottle.,Rhyme Over Reason : Phonological Motivation in English
guidguid,,
guit-guit,"A name, presumably in imitation of the cry of a bird.",Rhyme Over Reason : Phonological Motivation in English
gulch,To swallow or devour greedily.,Rhyme Over Reason : Phonological Motivation in English
gulp,To swallow in large draughts or morsels hastily or with greediness.,Rhyme Over Reason : Phonological Motivation in English
gurk,To belch.,Rhyme Over Reason : Phonological Motivation in English
gurl,"To rumble, growl; (of the wind) to roar, howl.",Rhyme Over Reason : Phonological Motivation in English
gurr,"A growl, snarl.",Rhyme Over Reason : Phonological Motivation in English
hackee,,
hadada(h),,
hallali,A bugle call.,Rhyme Over Reason : Phonological Motivation in English
hap,,
harr,To snarl as a dog; to make a rough guttural trill.,Rhyme Over Reason : Phonological Motivation in English
harrumph,A guttural sound made by clearing the throat.,Rhyme Over Reason : Phonological Motivation in English
hau-hau,To utter the cry of a hyena.,Rhyme Over Reason : Phonological Motivation in English
haunk-haunk,The cry of a hyena.,Rhyme Over Reason : Phonological Motivation in English
haw,An utterance marking hesitation.,Rhyme Over Reason : Phonological Motivation in English
haw-haw,An expression of hesitation uttered repeatedly in an affected tone.,Rhyme Over Reason : Phonological Motivation in English
heck,To cough slightly; to imitate the noise of a cough.,Rhyme Over Reason : Phonological Motivation in English
hee-haw,A conventional representation of the bray of a jackass.,Rhyme Over Reason : Phonological Motivation in English
hish,"The rushing or whishing noise made by a scythe cutting grass, etc.",Rhyme Over Reason : Phonological Motivation in English
hish,"To make the sharp spirant sound emitted by certain animals, as geese and serpents, or caused (e.g.) by the escape of steam through a narrow aperture, or uttered in the pronunciation of ’s’.",Rhyme Over Reason : Phonological Motivation in English
hiss,"To make the sharp spirant sound emitted by certain animals, as geese and serpents, or caused (e.g.) by the escape of steam through a narrow aperture, or uttered in the pronunciation of ’s’.",Rhyme Over Reason : Phonological Motivation in English
hist,"Used to enjoin silence, attract attention, or call on a person to listen.",Rhyme Over Reason : Phonological Motivation in English
hiz,To make a sound of hissing or as of a body rushing through the air.,Rhyme Over Reason : Phonological Motivation in English
hod,To bob up and down in riding; to jog.,Rhyme Over Reason : Phonological Motivation in English
honk,Of the driver of a car or other motor vehicle: to sound its horn.,Oxford English Dictionary
honk,Of a wild goose or (occasionally) other bird: to make its characteristic harsh cry.,Rhyme Over Reason : Phonological Motivation in English
honky-tonk,"a style of ragtime piano music having a melody embellished by chords and syncopated rhythms, and typically played on a piano which has been modified to give a tinny or jangly sound.",Oxford English Dictionary
hooshtah,"A shout of encouragement, to a camel.",Rhyme Over Reason : Phonological Motivation in English
hoss,To make the humming sibilant sound characteristic of bees and other insects.,Oxford English Dictionary
hough,To clear the throat.,Rhyme Over Reason : Phonological Motivation in English
hub a dub,The noise made by the beating of a drum.,Rhyme Over Reason : Phonological Motivation in English
huh-uh,An expression of negation.,Rhyme Over Reason : Phonological Motivation in English
hurr,To make or utter a dull sound of vibration or trilling; to buzz as an insect; to snarl as a dog; to pronounce a trilled r.,Rhyme Over Reason : Phonological Motivation in English
hush,The sound made by water flowing swiftly but smoothly.,Rhyme Over Reason : Phonological Motivation in English
hush,"To make silent, still, or quiet; to impose silence upon; to silence, quiet.",Oxford English Dictionary
huss,To make the humming sibilant sound characteristic of bees and other insects.,Oxford English Dictionary
hustling,To push or knock (a person) about roughly or unceremoniously; to jostle in a rough or violent fashion.,Oxford English Dictionary
huzz,To make the humming sibilant sound characteristic of bees and other insects.,Oxford English Dictionary
iddy-umpty,The Morse code; a dot followed by a dash in Morse code.,Rhyme Over Reason : Phonological Motivation in English
ish,To make the sound sh! as in striking the air forcibly.,Rhyme Over Reason : Phonological Motivation in English
jabber,To talk rapidly and indistinctly or unintelligibly; to speak volubly and with little sense; to prattle.,Rhyme Over Reason : Phonological Motivation in English
javer,To talk rapidly and indistinctly or unintelligibly; to speak volubly and with little sense; to prattle.,Rhyme Over Reason : Phonological Motivation in English
jabble,"To shake or mix up together; to shake up or agitate (a liquid), to cause to splash.",Rhyme Over Reason : Phonological Motivation in English
jack-bird,,
jam,"To press or squeeze (an object) tightly between two converging bodies or surfaces; to wedge or fix immovably in an opening, either by forcing the object in, or by the narrowing or closing in of the sides.",Rhyme Over Reason : Phonological Motivation in English
jar,To make or emit a harsh grating sound; to make a musical discord; to sound harshly or in discord with other sounds.,Rhyme Over Reason : Phonological Motivation in English
jarg,"Of a door or gate: To make a creaking noise, to grate, jar, vibrate.",Rhyme Over Reason : Phonological Motivation in English
jasch,The dash of a wave.,Rhyme Over Reason : Phonological Motivation in English
jaup,To dash and rebound like water with splashing of the vicinity; to move with splashing; to splash; to make a light splashing sound.,Rhyme Over Reason : Phonological Motivation in English
jawp,To dash and rebound like water with splashing of the vicinity; to move with splashing; to splash; to make a light splashing sound.,Rhyme Over Reason : Phonological Motivation in English
jing,"A sharp ring, a jingle.",Rhyme Over Reason : Phonological Motivation in English
jingle,"To give forth a mingling of ringing sounds, as by the striking together of coins, keys, or other small metallic objects; it expresses a more prolonged and continuous sound than clink, and a more complicated one than tinkle.",Rhyme Over Reason : Phonological Motivation in English
jink,To move with quick sudden action; to move or dart with sudden turns; to move jerkily to and fro.,Rhyme Over Reason : Phonological Motivation in English
jirble,"To spill (a liquid) by shaking or unsteady moving of the vessel; to pour out unsteadily; hence, to pour (liquid) from vessel to vessel.",Rhyme Over Reason : Phonological Motivation in English
job,"Of a bird: to peck. More generally: to penetrate into, to stab, pierce, or prod at.",Rhyme Over Reason : Phonological Motivation in English
jobble,An agitated movement of water.,Rhyme Over Reason : Phonological Motivation in English
jopper,To jolter or jolt.,Rhyme Over Reason : Phonological Motivation in English
joree,,
jot,"To jog, jolt, bump.",Rhyme Over Reason : Phonological Motivation in English
jower,To growl; to scold; to mutter or grumble in an undertone.,Rhyme Over Reason : Phonological Motivation in English
jub,"A thrust or knock with something blunt, a jog; the jog of a trotting horse.",Rhyme Over Reason : Phonological Motivation in English
juck,"To make a sound or call imitated by this word, as a partridge.",Rhyme Over Reason : Phonological Motivation in English
juke,"To make a sound or call imitated by this word, as a partridge.",Rhyme Over Reason : Phonological Motivation in English
jug,,
jur,"To butt with (or as with) the horns or head. Said of a ram, a battering-ram, etc.",Rhyme Over Reason : Phonological Motivation in English
jut,"To strike, knock, or push against something.",Rhyme Over Reason : Phonological Motivation in English
kaak,Of a crow: to make its characteristic harsh sound.,Rhyme Over Reason : Phonological Motivation in English
kae,,
katydid,,
keak,To cackle.,Rhyme Over Reason : Phonological Motivation in English
keck,To make a sound as if about to vomit; to retch; to feel an vomit; to retch; to feel an inclination to vomit.,Rhyme Over Reason : Phonological Motivation in English
keelie,,
kewt,Of a cat (occasionally of other animals): to make its characteristic cry; to utter a mew.,Rhyme Over Reason : Phonological Motivation in English
kill-cu,,
killdee,,
killdeer,,
kiskadee,,
ki-yi,"To howl or yelp as a dog, or utter a sound compared to this.",Rhyme Over Reason : Phonological Motivation in English
kling-kling,,
klop,The sound of the impact of something solid on a hard surface.,Rhyme Over Reason : Phonological Motivation in English
knal,"A stroke, knock, esp. on the head.",Rhyme Over Reason : Phonological Motivation in English
knap,"To strike with a hard short sound; to knack, knock, rap.",Rhyme Over Reason : Phonological Motivation in English
knickety-knock,An echoic word imitating an alternation of knocking sounds; hence adverbially: striking from side to side with alternation of sound.,Rhyme Over Reason : Phonological Motivation in English
knoll,"An act, or the action, of ringing or tolling a bell; the sound of a large bell.",Oxford English Dictionary
kyoodle,"To make a loud noise; to bark, to yap.",Rhyme Over Reason : Phonological Motivation in English
lab,"To speak indiscreetly; to blab, to gossip.",Oxford English Dictionary
la-di-da,A derisive term for one who affects gentility; a ‘swell’.,Rhyme Over Reason : Phonological Motivation in English
laldy,"A beating, a thrashing; punishment.",Rhyme Over Reason : Phonological Motivation in English
lall,"To say ‘lal, lal’; to speak childishly.",Rhyme Over Reason : Phonological Motivation in English
lamp,To go quickly by taking long steps.,Rhyme Over Reason : Phonological Motivation in English
lantum,,
lash,To move swiftly and suddenly.,Rhyme Over Reason : Phonological Motivation in English
lill,To loll or hang (the tongue) out (rarely forth).,Rhyme Over Reason : Phonological Motivation in English
lob,To move heavily or clumsily; to walk along with a slow lumbering movement.,Oxford English Dictionary
loblolly,,
log,"To rock, move to and fro.",Rhyme Over Reason : Phonological Motivation in English
logger,To hang loosely and largely.,Rhyme Over Reason : Phonological Motivation in English
lop,A state of the sea in which the waves are short and lumpy.,Rhyme Over Reason : Phonological Motivation in English
lop,To hang loosely or limply; to droop; to flop or sway limply about.,Rhyme Over Reason : Phonological Motivation in English
losh,To fall with a splash; to go stumbling.,Rhyme Over Reason : Phonological Motivation in English
lounder,"A heavy, swingeing blow.",Rhyme Over Reason : Phonological Motivation in English
loune,To utter the cry of the crane.,Rhyme Over Reason : Phonological Motivation in English
lout,To low or bellow.,Rhyme Over Reason : Phonological Motivation in English
lull,To soothe with sounds or caresses; to induce to sleep or to pleasing quiescence.,Rhyme Over Reason : Phonological Motivation in English
lulla,To soothe with a lullaby; to sing to sleep.,Rhyme Over Reason : Phonological Motivation in English
lulliloo,To utter the cries by which certain African peoples express delight.,Rhyme Over Reason : Phonological Motivation in English
lunch,The sound made by the fall of a soft heavy body.,Rhyme Over Reason : Phonological Motivation in English
maa,Of a sheep or lamb: to utter its distinctive cry; to bleat.,Rhyme Over Reason : Phonological Motivation in English
maule,To cry like a cat; to mew.,Rhyme Over Reason : Phonological Motivation in English
meep,"A short, high-pitched sound.",Rhyme Over Reason : Phonological Motivation in English
mew,Of a cat (occasionally of other animals): to make its characteristic cry; to utter a mew.,Rhyme Over Reason : Phonological Motivation in English
mewt,Of a cat (occasionally of other animals): to make its characteristic cry; to utter a mew.,Rhyme Over Reason : Phonological Motivation in English
mewl,"Esp. of an infant: to cry feebly, to whimper; to make a whining noise.",Rhyme Over Reason : Phonological Motivation in English
miaow,Of a cat: to make its characteristic cry.,Rhyme Over Reason : Phonological Motivation in English
miff,"A fit of pique, a huff; a petty quarrel, a tiff.",Rhyme Over Reason : Phonological Motivation in English
mim,"Reserved or restrained inmanner or behaviour, esp. in a contrived or priggish way; affectedly modest, demure; primly silent, quiet; affectedly moderate or abstemious in diet (rare).",Rhyme Over Reason : Phonological Motivation in English
mimp,"A prim, or affectedly modest or demure, woman.",Rhyme Over Reason : Phonological Motivation in English
mm,"Expressing satisfaction, approval, or assent.",Rhyme Over Reason : Phonological Motivation in English
moo,The lowing sound made by a cow or other bovine animal; an imitation of this.,Rhyme Over Reason : Phonological Motivation in English
mop,"A concluding rhythmic flourish to a piece of jazz music, announcing a surprising denouement",Rhyme Over Reason : Phonological Motivation in English
morepork,,
mph,"Expressing disapproval, doubt, or dissatisfaction.",Rhyme Over Reason : Phonological Motivation in English
mphm,"Expressing disapproval, doubt, or dissatisfaction.",Rhyme Over Reason : Phonological Motivation in English
muff,Chiefly in negative contexts: to utter a word; to speak.,Rhyme Over Reason : Phonological Motivation in English
muffle,To speak indistinctly.,Rhyme Over Reason : Phonological Motivation in English
mum,"An inarticulate sound made with closed lips, usually as an indication of inability or unwillingness to speak; (in a negative context) the slightest utterance.",Rhyme Over Reason : Phonological Motivation in English
mum,"To utter a faint sound; to speak softly or indistinctly; to whisper; to mutter, mumble.",Rhyme Over Reason : Phonological Motivation in English
mump,"A grimace, a moue; an exaggerated facial expression.",Rhyme Over Reason : Phonological Motivation in English
mump,To grimace; to form the lips into a grimace or grin; to convey a thought or meaning indirectly by one’s facial expression.,Rhyme Over Reason : Phonological Motivation in English
murr,To make a harsh noise.,Rhyme Over Reason : Phonological Motivation in English
murre,To make a harsh noise.,Oxford English Dictionary
muruk,,
mustle,"To murmur, make a noise.",Rhyme Over Reason : Phonological Motivation in English
mwah,"An exaggerated kiss, esp. one given on the cheek to a social acquaintance; an air kiss.",Rhyme Over Reason : Phonological Motivation in English
nicker,"Of a horse, donkey, etc.: to make a soft noise, as when recognizing a foal or being offered a titbit.",Rhyme Over Reason : Phonological Motivation in English
