Entry,Definition,ref
a,"Expressing invocation, surprise,  or admiration; (also) used to gain attention.",Rhyme Over Reason : Phonological Motivation in English
achoo,Representing the sound of a sneeze.,Rhyme Over Reason : Phonological Motivation in English
atishoo,Representing the sound of a sneeze.,Rhyme Over Reason : Phonological Motivation in English
atichoo,Representing the sound of a sneeze.,Rhyme Over Reason : Phonological Motivation in English
ahem,"An exclamation representing a slight cough or clearing of the throat, used (a) to attract attention, esp. prior to speaking (b) to express hesitation, (mock) disapproval, embarrassment, suggestiveness, etc.",Oxford English Dictionary
ai,"An exclamation of surprise, regret, pain, etc., often used in imitation of foreign speakers of English.",Rhyme Over Reason : Phonological Motivation in English
aie,"Awailing exclamation of resignation, surprise, regret, alarm, etc.; sometimes imitative of non-British speakers of English.",Rhyme Over Reason : Phonological Motivation in English
alew,A cry of sorrow or lamentation.,Rhyme Over Reason : Phonological Motivation in English
arf,"Representing the bark of a (small) dog, or a human imitation of such a bark.",Rhyme Over Reason : Phonological Motivation in English
argh,"Expressing pain or fright; (also) expressing anguish, disappointment, or frustration.",Rhyme Over Reason : Phonological Motivation in English
aw,"An exclamation usually expressing mild remonstrance, entreaty, commiseration, disgust, or disapproval.",Rhyme Over Reason : Phonological Motivation in English
bada-bing,"Suggesting something happening suddenly, emphatically, or easily and predictably.",Rhyme Over Reason : Phonological Motivation in English
bam,An interjection imitating the sound of a hard blow.,Rhyme Over Reason : Phonological Motivation in English
bangarang,Commotion or uproar; a disturbance; a loud argument.,Oxford English Dictionary
baugh,"To bark, as a dog.",Rhyme Over Reason : Phonological Motivation in English
baw,"To bark, as a dog.",Rhyme Over Reason : Phonological Motivation in English
baw-waw,The barking of a dog.,Rhyme Over Reason : Phonological Motivation in English
bebop,,
beep,"The sound made by a horn on a motor car or other vehicle; a short high-pitched sound such as is emitted by an echo-sounder, a radar device, etc.",Rhyme Over Reason : Phonological Motivation in English
beep,To sound (a horn); to make (something) emit a short high-pitched sound.,Rhyme Over Reason : Phonological Motivation in English
bewh,"To bark in a thin voice, to yelp.",Rhyme Over Reason : Phonological Motivation in English
bif,"An exclamation uttered when something strikes an object, or a sound imitative of such a blow.",Rhyme Over Reason : Phonological Motivation in English
biff,"An exclamation uttered when something strikes an object, or a sound imitative of such a blow.",Rhyme Over Reason : Phonological Motivation in English
biff,"To hit, strike.",Rhyme Over Reason : Phonological Motivation in English
bing,A thump or blow.,Rhyme Over Reason : Phonological Motivation in English
bingo,An exclamation made by someone winning a game of bingo.,Rhyme Over Reason : Phonological Motivation in English
birl,"To move on with rotatory motion, as a rifle bullet.",Rhyme Over Reason : Phonological Motivation in English
bish,To throw.,Rhyme Over Reason : Phonological Motivation in English
blad,"To deal a blow to, to slap heavily.",Rhyme Over Reason : Phonological Motivation in English
blah,"Meaningless, insincere, or pretentious talk or writing; nonsense, bunkum. Also used as a derisive interjection.",Rhyme Over Reason : Phonological Motivation in English
blash,"A dash or plash of liquid, as when rain appears to fall in sheets; a mixture of blow and splash.",Rhyme Over Reason : Phonological Motivation in English
blat,A bleating or shrill sound.,Rhyme Over Reason : Phonological Motivation in English
blea,To bleat as a lamb or kid; to cry piteously as a child.,Rhyme Over Reason : Phonological Motivation in English
blear,To protrude the tongue in mockery.,Rhyme Over Reason : Phonological Motivation in English
bleep,"A thin, high-pitched blipping sound, spec. one made by electronic equipment.",Rhyme Over Reason : Phonological Motivation in English
bling,(A piece of) ostentatious jewellery. Hence: wealth; conspicuous consumption.,Rhyme Over Reason : Phonological Motivation in English
blip,Any sudden brisk blow or twitch; a quick popping sound.,Rhyme Over Reason : Phonological Motivation in English
blip,To strike with a brisk rap or tap.,Rhyme Over Reason : Phonological Motivation in English
blirt,"To burst into tears, weep violently; disfigure with tears. ",Rhyme Over Reason : Phonological Motivation in English
blizzard,A sharp blow or knock; a shot.,Rhyme Over Reason : Phonological Motivation in English
blodge,"A large irregular spot or patch of light, colour, or the like; a blot, smear, or stain.",Rhyme Over Reason : Phonological Motivation in English
splotch,"A large irregular spot or patch of light, colour, or the like; a blot, smear, or stain.",Rhyme Over Reason : Phonological Motivation in English
bloop,A plopping sound; a howling sound.,Rhyme Over Reason : Phonological Motivation in English
bloop,To make a howling noise; to operate a radio set in such a way that it emits such a noise.,Rhyme Over Reason : Phonological Motivation in English
blotch,"An inflamed eruption, or discoloured patch, on the skin; a pustule, boil, or botch.",Rhyme Over Reason : Phonological Motivation in English
blout,"The sudden breaking of a storm; a sudden downpour of rain, hail, etc., accompanied by wind.",Rhyme Over Reason : Phonological Motivation in English
bluff,"To swell out, become distended.",Rhyme Over Reason : Phonological Motivation in English
blumbering,"Rumbling, lumbering noise.",Rhyme Over Reason : Phonological Motivation in English
blunge,"To mix (clay, powdered flint, etc.) up with water.",Rhyme Over Reason : Phonological Motivation in English
blurt,To emit the breath eruptively from the mouth; to snort in sleep.,Rhyme Over Reason : Phonological Motivation in English
bluther,To cry with a voice smothered with tears and sobs.,Oxford English Dictionary
bob,"To move up and down like a buoyant body in water, or an elastic body on land; hence, to dance; to move to and fro with a similar motion, esp. said of hanging things rebounding from objects lightly struck by them.",Rhyme Over Reason : Phonological Motivation in English
boffo,A hearty laugh.,Oxford English Dictionary
boing,The noise made when a compressed spring is suddenly released; a reverberating sound.,Rhyme Over Reason : Phonological Motivation in English
boink,"A bump; a blow. Also: a brief resonant sound, such as might accompany this.",Rhyme Over Reason : Phonological Motivation in English
bom,The sound caused by the discharge of a gun.,Oxford English Dictionary
bong,"Representing a low-pitched, resonant sound of the kind made by the ringing of large bell, the striking of a gong, etc.",Oxford English Dictionary
bonk,"An abrupt, heavy sound, as when a solid object strikes a hard surface or bony part of the body.",Rhyme Over Reason : Phonological Motivation in English
bonk,To hit (a solid surface or bony part of the body) resoundingly with or against something hard and unyielding.,Rhyme Over Reason : Phonological Motivation in English
boobook,,
boom,"To hum as a bee or beetle; to make a loud, deep sound with much resonance, as a cannon, a large bell, the waves of the sea, etc.",Rhyme Over Reason : Phonological Motivation in English
bop,A short abrupt explosive sound.,Rhyme Over Reason : Phonological Motivation in English
pop,A short abrupt explosive sound.,Rhyme Over Reason : Phonological Motivation in English
bop,"To hit, strike, punch.",Rhyme Over Reason : Phonological Motivation in English
bosh,"Indicating something which happens suddenly, quickly, or effortlessly.",Rhyme Over Reason : Phonological Motivation in English
bow-wow,An imitation of the barking of a dog.,Rhyme Over Reason : Phonological Motivation in English
brash,"Fragile, brittle: used chiefly of timber.",Rhyme Over Reason : Phonological Motivation in English
brattle,"A smart rattling sound, esp. of something breaking or bursting.",Rhyme Over Reason : Phonological Motivation in English
brr-brr,"Representing a repetitive mechanical or electronic noise, esp. that of a telephone’s buzzer or ringtone.",Rhyme Over Reason : Phonological Motivation in English
brrr,"Used as an exclamation to accompany a shiver of cold, fear, disquiet, etc.",Rhyme Over Reason : Phonological Motivation in English
brum,"To murmur, to hum.",Rhyme Over Reason : Phonological Motivation in English
brum,Representing a humming or murmuring sound.,Rhyme Over Reason : Phonological Motivation in English
bruzz,To growl as a bear.,Rhyme Over Reason : Phonological Motivation in English
buff,"To speak with obstructed and explosive utterance, to stutter.",Rhyme Over Reason : Phonological Motivation in English
buff,,
buffle,,
buln-buln,,
bum,"A humming, buzzing, or droning sound.",Oxford English Dictionary
bum,To drink esp. in a greedy or guzzling manner.,Oxford English Dictionary
bumble,"A confused, disorganized, or untidy collection of things",Oxford English Dictionary
bump,"A blow somewhat heavy, but rather dull in sound; a sudden collision, more or less violent.",Rhyme Over Reason : Phonological Motivation in English
bump,A word used to express the cry of the bittern.,Rhyme Over Reason : Phonological Motivation in English
bunch,"To strike, thump; to bruise flax, etc., by beating it.",Rhyme Over Reason : Phonological Motivation in English
bung,To throw (violently); to send; to put forcibly.,Rhyme Over Reason : Phonological Motivation in English
bungle,To do or make in a clumsy or unskilful manner.,Rhyme Over Reason : Phonological Motivation in English
burp,To belch.,Rhyme Over Reason : Phonological Motivation in English
burr,"A rough sounding of the letter r, a vibratory or rushing noise.",Oxford English Dictionary
buzz,To make the humming sibilant sound characteristic of bees and other insects.,Oxford English Dictionary
buzzle,"To distend, fill out.",Rhyme Over Reason : Phonological Motivation in English
byss,To sing or hum (children) to sleep.,Rhyme Over Reason : Phonological Motivation in English
calloo,,
cangle,"To dispute acrimoniously, to wrangle.",Rhyme Over Reason : Phonological Motivation in English
cank,"To cackle as geese; to talk rapidly, to chatter.",Rhyme Over Reason : Phonological Motivation in English
caw,"Of a crow, rook, raven, or other bird: to make its characteristic harsh sound.",Rhyme Over Reason : Phonological Motivation in English
caw,"Representing the characteristic harsh call of a crow, rook, raven, or other bird, or a sound resembling this.",Rhyme Over Reason : Phonological Motivation in English
cawk,"The cry of some birds, rooks, divers, etc.",Rhyme Over Reason : Phonological Motivation in English
chaak,,
chack,"To make a noise like that of snapping teeth, to clack, clatter.",Rhyme Over Reason : Phonological Motivation in English
chack-chack,The cry of the fieldfare and wheatear.,Rhyme Over Reason : Phonological Motivation in English
chang,A ringing or resonant sound; a representation of this.,Rhyme Over Reason : Phonological Motivation in English
channer,"To grumble, complain; to chide, scold, nag.",Rhyme Over Reason : Phonological Motivation in English
charr,,
chatter,"Of a bird: to utter a series of short, quick, usually high-pitched sounds. Also to utter a note or song; to twitter.",Oxford English Dictionary
cheep,"Of a small animal, esp. a young bird or a mouse: to make a thin, high-pitched cry.",Rhyme Over Reason : Phonological Motivation in English
cheet,"To chirp, squeak.",Rhyme Over Reason : Phonological Motivation in English
cheet,Representing the high-pitched call of certain birds.,Oxford English Dictionary
che-ho,To sneeze.,Rhyme Over Reason : Phonological Motivation in English
chewink,,
chick,"Of a bird (esp. a chicken) or another animal: to make a short, distinct sound; to chirp.",Oxford English Dictionary
chick,"A regular short, distinct sound made by a clock or watch.",Oxford English Dictionary
chicker,To chirp as a cricket.,Rhyme Over Reason : Phonological Motivation in English
chink,"An imitation of the short, sharp sound produced by pieces of metal or glass striking one another.",Rhyme Over Reason : Phonological Motivation in English
chinkerinchee,,
chirl,"To warble, to utter a long note with modulation; sometimes, to emit a low melancholy sound.",Rhyme Over Reason : Phonological Motivation in English
chit,To chirp.,Rhyme Over Reason : Phonological Motivation in English
chit-chit-chat,,
chock,"A short hollow sound, such as that produced by hammering or chopping, by a heavy object striking a hard surface, etc.",Rhyme Over Reason : Phonological Motivation in English
chock,"Representing a short hollow sound, such as that produced by hammering or chopping, by a heavy object striking a hard surface, etc.",Rhyme Over Reason : Phonological Motivation in English
choo-choo,"An imitation of the sound of a steam-engine, used as a nursery name for a railway train or locomotive.",Rhyme Over Reason : Phonological Motivation in English
chowchilla,,
chuck,"A short, distinct sound made by an animal, esp. a bird, a clucking sound made by a chicken",Oxford English Dictionary
chuck,"A species of cluck: e.g. that made by a cock, or a hen calling chickens, or by people in calling fowls; also that made to incite a horse.",Rhyme Over Reason : Phonological Motivation in English
chuckle,To laugh vehemently; to laugh convulsively.,Rhyme Over Reason : Phonological Motivation in English
chuck-will’s-widow,,
chud,To champ; to bite.,Oxford English Dictionary
chuff,Of an engine or machine: to work with a regularly repeated sharp puffing sound.,Rhyme Over Reason : Phonological Motivation in English
chug,"A plunging, muffled, or explosive sound, esp. the characteristic sound of an internal combustion engine when running slowly.",Rhyme Over Reason : Phonological Motivation in English
chug,To make an intermittent explosive sound as of the escape of exhaust gases from an engine cylinder.,Rhyme Over Reason : Phonological Motivation in English
chug-a-lug,"Representing a glugging, chugging, or gobbling sound, esp. that of a person consuming a drink in large gulps.",Rhyme Over Reason : Phonological Motivation in English
chunk,To proceed with a plunging or explosive sound.,Rhyme Over Reason : Phonological Motivation in English
chunter,"To mutter, murmur; to grumble, find fault, complain.",Rhyme Over Reason : Phonological Motivation in English
churr,To make a deep or low trilled or whirring sound.,Rhyme Over Reason : Phonological Motivation in English
chutter,"To make a clattering, spluttering noise.",Rhyme Over Reason : Phonological Motivation in English
chymer,To shiver,Rhyme Over Reason : Phonological Motivation in English
clack-clack,,
clam,The crash caused by ringing two or more bells of a peal together.,Rhyme Over Reason : Phonological Motivation in English
clamp,"A heavy, solid step, tread, or stamp with the feet.",Rhyme Over Reason : Phonological Motivation in English
clash,"The loud sound of collision made by a heavy stroke or blow, the first impact of which is firm and hard, but is followed by a confused sound of many looser and lighter impacts.",Rhyme Over Reason : Phonological Motivation in English
click,"A short sharp sound, as produced by two hard objects being lightly struck against each other, or by operating a switch.",Oxford English Dictionary
clippety-clop,"The sound made by a horse’s hoofs, or a noise resembling this.",Rhyme Over Reason : Phonological Motivation in English
clobber,"To patch up, cobble.",Rhyme Over Reason : Phonological Motivation in English
clondre,"To make a rumbling noise, to drone.",Rhyme Over Reason : Phonological Motivation in English
clonk,"To make an abrupt, heavy sound as when something unresilient strikes a hard surface.",Rhyme Over Reason : Phonological Motivation in English
cloop,"The sound made by drawing a cork from a bottle, or any similar sound.",Rhyme Over Reason : Phonological Motivation in English
clop,A sharp sound such as is made by shoes or hoofs on the ground.,Rhyme Over Reason : Phonological Motivation in English
cluck,"An imitation of the abrupt hollow guttural sound made by a hen desiring to sit, or calling her brood together, or of a similar sound.",Rhyme Over Reason : Phonological Motivation in English
clucker,To call as a hen does her chickens.,Rhyme Over Reason : Phonological Motivation in English
clunk,"A sound such as is made by a cork drawn forcibly from a bottle, by liquid poured out of a narrow-necked vessel, or shaken in a vessel partially empty, etc.",Rhyme Over Reason : Phonological Motivation in English
cocket,,
colp,,
conck,The cry of the wild goose.,Rhyme Over Reason : Phonological Motivation in English
coo,To make the soft murmuring sound or note characteristic of doves and pigeons.,Rhyme Over Reason : Phonological Motivation in English
cooee,The call or cry used as a signal to draw attention to the caller.,Oxford English Dictionary
crank,"To make a harsh, jarring, or grating sound.",Rhyme Over Reason : Phonological Motivation in English
crash,"To break in pieces with violence and noise; to dash in pieces, shiver, shatter.",Rhyme Over Reason : Phonological Motivation in English
craw,Said of rooks or crows.,Rhyme Over Reason : Phonological Motivation in English
crawk,To utter a hoarse sound.,Rhyme Over Reason : Phonological Motivation in English
creak,"To utter a harsh cry: said of crows, rooks, etc.",Rhyme Over Reason : Phonological Motivation in English
crick,"To make a thin, sharp sound.",Rhyme Over Reason : Phonological Motivation in English
crimp,"To make a crisp sound, as in the compression of snow under the feet.",Rhyme Over Reason : Phonological Motivation in English
cronk,The croak of a raven.,Rhyme Over Reason : Phonological Motivation in English
croo,To make the murmuring sound of a dove.,Rhyme Over Reason : Phonological Motivation in English
crood,To make the murmuring sound of a dove.,Rhyme Over Reason : Phonological Motivation in English
croud,To make the murmuring sound of a dove.,Rhyme Over Reason : Phonological Motivation in English
crook,To croak.,Rhyme Over Reason : Phonological Motivation in English
crool,To make an inarticulate sound more liquid and prolonged than a croak.,Rhyme Over Reason : Phonological Motivation in English
croop,"To cry hoarsely; to croak as a raven, frog, crane, etc.",Rhyme Over Reason : Phonological Motivation in English
crout,To make abrupt croaking or murmuring noises.,Rhyme Over Reason : Phonological Motivation in English
crunkle,"To make a harsh dry sound, as by grinding the jaws.",Rhyme Over Reason : Phonological Motivation in English
curkle,To cry as a quail.,Rhyme Over Reason : Phonological Motivation in English
curl,"Of a cat or another feline animal: to make a low, continuous, vibratory sound taken to be expressive of satisfaction or pleasure.",Rhyme Over Reason : Phonological Motivation in English
curling,Rumbling in the bowels.,Rhyme Over Reason : Phonological Motivation in English
curmur,To make a low murmuring or purring sound.,Rhyme Over Reason : Phonological Motivation in English
curr,,
curr,"To make a low murmuring sound, like the cooing of a dove or purring of a cat.",Rhyme Over Reason : Phonological Motivation in English
dadder,"To shake, tremble; to totter.",Rhyme Over Reason : Phonological Motivation in English
dah,"In Morse telegraphy, etc.: = dash.",Rhyme Over Reason : Phonological Motivation in English
daud,A heavy blow or thump; a thud.,Rhyme Over Reason : Phonological Motivation in English
daud,"To strike with a heavy blow or thump; to knock, beat; to shake by knocking or beating.",Rhyme Over Reason : Phonological Motivation in English
der,"Implying that another person has said something foolish or extremely obvious, or done something stupid.",Rhyme Over Reason : Phonological Motivation in English
dickcissel,,
diddle,To sing without distinct utterance of words.,Rhyme Over Reason : Phonological Motivation in English
didgeridoo,,
diederik,,
diedrik,,
ding,To sound as metal when heavily struck; to make a heavy ringing sound.,Rhyme Over Reason : Phonological Motivation in English
ding-a-ling,"An imitation of the ringing sound of a heavy bell, or of metal when struck.",Rhyme Over Reason : Phonological Motivation in English
ding-dong,"To ring as a bell, or like a bell.",Rhyme Over Reason : Phonological Motivation in English
ding-dong,An imitation of the sound of a bell.,Rhyme Over Reason : Phonological Motivation in English
dink,A drop-shot in lawn tennis.,Rhyme Over Reason : Phonological Motivation in English
dit,"In Morse telegraphy, etc.: = dot.",Rhyme Over Reason : Phonological Motivation in English
dod,"To beat, knock.",Rhyme Over Reason : Phonological Motivation in English
dong,An imitation of the deep sound of a large bell.,Rhyme Over Reason : Phonological Motivation in English
dong,To sound as a large bell.,Rhyme Over Reason : Phonological Motivation in English
doof,"Imitating the sound of a dull blow, thud, or drumbeat.",Rhyme Over Reason : Phonological Motivation in English
doo-wop,,
drant,To drawl or drone in speech.,Rhyme Over Reason : Phonological Motivation in English
draunt,To drawl or drone in speech.,Rhyme Over Reason : Phonological Motivation in English
dub,A beat of a drum; the sound of a drum when beaten.,Rhyme Over Reason : Phonological Motivation in English
dub,To thrust: now implying a moderately firm blunt thrust or poke.,Rhyme Over Reason : Phonological Motivation in English
dub-a-dub,The sound made in beating a drum.,Rhyme Over Reason : Phonological Motivation in English
duff,"Representing the sound of a dull blow, thud, or drumbeat.",Rhyme Over Reason : Phonological Motivation in English
duh,Expressing inarticulacy or incomprehension. Also (usually mildly derogatory): implying that another person has said something foolish or extremely obvious.,Rhyme Over Reason : Phonological Motivation in English
dunkadoo,,
eek,"Expressing (frequently mock) astonishment, alarm, horror, or surprise.",Rhyme Over Reason : Phonological Motivation in English
er,Used to express the inarticulate sound or murmur made by a hesitant speaker.,Rhyme Over Reason : Phonological Motivation in English
ew,"Used as an emphatic expression, chiefly of disgust, but also (formerly) of surprise or approval.",Rhyme Over Reason : Phonological Motivation in English
faffle,To stutter or stammer; to utter incoherent sounds.,Rhyme Over Reason : Phonological Motivation in English
fap fap fap,Representing the sound of (esp. male) masturbation.,Rhyme Over Reason : Phonological Motivation in English
fiff,,
fillip,A movement made by bending the last joint of a finger against the thumb and suddenly releasing it; a smart stroke or tap given by this means.,Rhyme Over Reason : Phonological Motivation in English
filly-folly,A foolish or ridiculous notion; a foolish hobby.,Rhyme Over Reason : Phonological Motivation in English
fissle,To make a slight continued noise; to rustle; to move with such a noise.,Rhyme Over Reason : Phonological Motivation in English
fistle,To make a slight continued noise; to rustle; to move with such a noise.,Rhyme Over Reason : Phonological Motivation in English
fix-fax,"Hurry, the middle of any business.",Rhyme Over Reason : Phonological Motivation in English
fiz,To make a hissing or sputtering sound.,Rhyme Over Reason : Phonological Motivation in English
fizz,To make a hissing or sputtering sound.,Rhyme Over Reason : Phonological Motivation in English
flab,To flap the wings.,Rhyme Over Reason : Phonological Motivation in English
flabby,"Hanging loose by its own weight, yielding to the touch and easily moved or shaken, flaccid, limp, soft; said chiefly of or with respect to flesh.",Rhyme Over Reason : Phonological Motivation in English
flack,"A blow, slap, or stroke.",Rhyme Over Reason : Phonological Motivation in English
flaff,"To flap, make a flapping; to flutter.",Rhyme Over Reason : Phonological Motivation in English
flam,,
flank,"To whip with a light, sudden stroke.",Rhyme Over Reason : Phonological Motivation in English
flap,To strike with a sudden blow.,Rhyme Over Reason : Phonological Motivation in English
flash,"A sudden outburst or issuing forth of flame or light; a sudden, quick, transitory blaze.",Oxford English Dictionary
flash,"A sudden movement of a body of water, a splash",Oxford English Dictionary
flasker,To flap about (as a fish); to flutter (as a bird); to flounder.,Rhyme Over Reason : Phonological Motivation in English
flatter,"To float, flutter.",Rhyme Over Reason : Phonological Motivation in English
fleg,"A random blow or kick, a stroke.",Rhyme Over Reason : Phonological Motivation in English
flerk,To make a jerking movement.,Rhyme Over Reason : Phonological Motivation in English
flibbertigibbet,A chattering or gossiping person; a flighty or frivolous woman.,Rhyme Over Reason : Phonological Motivation in English
flick,"A light blow, esp. one given with something pliant, a whip, etc., or with the finger-nail.",Rhyme Over Reason : Phonological Motivation in English
flicker,To flutter; to hover. occasionally To flap the wings; to move by flapping the wings.,Oxford English Dictionary
flim-flam,"A piece of nonsense or idle talk; a trifle, a conceit.",Rhyme Over Reason : Phonological Motivation in English
flimmer,To burn unsteadily.,Rhyme Over Reason : Phonological Motivation in English
flip,"The action or an act of tossing, or turning something over, and related senses.",Oxford English Dictionary
